{
  "candidate_requests": [
    {
      "finding_id": "finding_mobility_access",
      "id": "generate_mobility_access_candidates",
      "output_kind": "DiscoveryCandidateIntervention",
      "prompt": "Generate 2-4 DiscoveryCandidateIntervention JSON objects for this finding. Do not certify safety. Compare labor, energy, privacy, public-health, accessibility, governance, scenario resilience, and new risks. Use only retrieved context plus explicit assumptions.",
      "required_candidate_count": 3
    }
  ],
  "evaluation_contract": {
    "hard_rejection_rules": [
      "Reject candidates that create new survival-critical unmet demand.",
      "Reject candidates that hide labor by moving it into untracked resident work.",
      "Reject candidates that lower privacy, consent, accessibility, or public-health visibility without an explicit mitigation.",
      "Reject candidates that require a professional license or legal authority but omit that dependency."
    ],
    "metrics_to_compare": [
      "resource_telemetry.resources.current_ratio",
      "resource_telemetry.resources.net_per_day",
      "resource_telemetry.labor.required_minutes_per_resident_per_day",
      "capabilities.domain_statuses",
      "scenario.total_unmet_delta",
      "scenario.blocked_review_domain_count"
    ],
    "output_schema": "schemas/discovery_candidate_intervention.schema.json",
    "scenarios_to_run": [
      "scenario_illness_wave",
      "water_contamination_response_v2"
    ]
  },
  "findings": [
    {
      "domain": "mobility_access",
      "evidence": [
        "Accessible-route coverage is not complete.",
        "Mobility Access capability status.",
        "Spatial profile is provisional; survey, accessibility, emergency, utility, drainage, and code review remain unresolved.",
        "mobility_access: Accessible-route coverage is not complete."
      ],
      "id": "finding_mobility_access",
      "module_refs": [
        "mobility_access.pedestrian_first_access_commons.v0_1"
      ],
      "scenario_ids": [
        "scenario_illness_wave",
        "water_contamination_response_v2"
      ],
      "severity": "warning",
      "summary": "Mobility Access discovery loop is needed because: Accessible-route coverage is not complete.",
      "target_objects": []
    }
  ],
  "focus": "mobility_access",
  "id": "discovery_civic_floor_730_v0_pop_486_mobility_access_v0",
  "kind": "DiscoveryLoopReport",
  "n8n_contract": {
    "artifact_outputs": [
      "examples/discovery/*.discovery.json",
      "candidate_interventions/*.json",
      "examples/discovery/*_comparison.json"
    ],
    "local_model_provider": "Ollama",
    "rag_role": "Retrieve local CIaC context before candidate generation.",
    "required_nodes": [
      "Manual Trigger or Webhook",
      "Execute Command: ciac discovery-loop",
      "Vector Store Retriever",
      "Ollama Chat Model",
      "Code: JSON repair and split",
      "Execute Command: ciac validate candidate_interventions",
      "Execute Command: ciac discovery-compare or simulation commands"
    ],
    "workflow": "n8n/workflow_specs/discovery_lab_pipeline.md"
  },
  "next_actions": [
    "Run retrieval_plan queries against the local vector store.",
    "Ask Ollama to generate DiscoveryCandidateIntervention JSON only; reject prose-only answers.",
    "Validate each candidate with `py -3.10 -m ciac validate <candidate_dir>`.",
    "Run candidate simulation or pressure-test commands before promotion.",
    "Write accepted candidates to candidate_interventions/ with source_loop_id preserved."
  ],
  "provisional": true,
  "retrieval_plan": [
    {
      "domain": "mobility_access",
      "id": "retrieve_mobility_access",
      "query": "CIaC mobility access warning interventions expected effects labor energy privacy public health governance accessibility scenario resilience",
      "required_context": [
        "relevant civic patterns and capability effects",
        "module reports and sprint plans",
        "runtime warnings and current telemetry",
        "scenario failure modes and recovery requirements"
      ]
    }
  ],
  "seed_candidates": [
    {
      "assumptions": [
        {
          "confidence": "low",
          "id": "assumption_1_local_fit",
          "needs_evidence": true,
          "statement": "Candidate is generated from CIaC warning context and must be checked against local law, safety, consent, and engineering constraints before promotion."
        }
      ],
      "expected_effects": [
        {
          "direction": "increase",
          "metric": "accessible_route_coverage",
          "rationale": "Generated hypothesis expects accessible_route_coverage to increase."
        },
        {
          "direction": "increase",
          "metric": "spatial_review_burden",
          "rationale": "Generated hypothesis expects spatial_review_burden to increase."
        },
        {
          "direction": "increase",
          "metric": "non_driver_access",
          "rationale": "Generated hypothesis expects non_driver_access to increase."
        }
      ],
      "focus_domain": "mobility_access",
      "hypothesis": "Every daily task route should declare grade, surface, rest points, lighting, and emergency access status so population scaling cannot hide access gaps.",
      "id": "mobility_access_accessible_route_coverage_map_v0",
      "intervention_type": "pattern_patch",
      "kind": "DiscoveryCandidateIntervention",
      "module_refs": [
        "mobility_access.pedestrian_first_access_commons.v0_1"
      ],
      "provisional": true,
      "rag_context": {
        "queries": [
          "CIaC mobility access warning interventions expected effects labor energy privacy public health governance accessibility scenario resilience"
        ],
        "required_sources": [
          "patterns/",
          "docs/module_reports/",
          "examples/generated/micro_commons_runtime_bundle.json",
          "examples/world_manifests/civic_floor_80_v0.world.json"
        ],
        "source_ids": []
      },
      "risk_tradeoffs": [
        {
          "mitigation": "Mark all route claims provisional until surveyed.",
          "risk": "Proxy geometry may imply false compliance",
          "severity": "high"
        }
      ],
      "simulation_hooks": {
        "acceptance_tests": [
          "No new survival-critical unmet demand is introduced.",
          "No labor is shifted into untracked resident burden.",
          "Privacy, consent, public-health, accessibility, and governance assumptions remain explicit."
        ],
        "metrics_to_compare": [
          "resource_telemetry.labor.required_minutes_per_resident_per_day",
          "capabilities.domain_statuses",
          "scenario.blocked_review_domain_count"
        ],
        "scenarios_to_run": [
          "scenario_illness_wave",
          "water_contamination_response_v2"
        ]
      },
      "source_loop_id": "discovery_civic_floor_730_v0_pop_486_mobility_access_v0",
      "status": "draft",
      "target_objects": [],
      "title": "Accessible route coverage map",
      "version": "v0"
    }
  ],
  "source": {
    "population": 486,
    "runtime_bundle_path": "examples\\generated\\micro_commons_runtime_bundle.json",
    "scale_class": "multi_block_district",
    "world_id": "civic_floor_730_v0_pop_486",
    "world_manifest_path": "browser:civic_floor_730_v0_pop_486"
  },
  "status": "ready_for_generation",
  "version": "v0"
}
